name,category,rating,address,phone,website,keyword,location,status,pain_points,opportunities,business_size,digital_presence,priority_score,outreach_message
Goodtime Restaurant & Bar,Restoran Thailand,"4,9","
Jl. Senopati No.74, RT.7/RW.3, Selong, Kec. Kebayoran Lama, Kota Jakarta Selatan, Daerah Khusus Ibukota Jakarta 12110","
0852-1650-6506",https://goodtimejakarta.com/,restoran,Jaksel,pending,"Ketergantungan pada lokasi fisik, potensi kehilangan pelanggan karena perubahan tren kuliner, kompetisi dari restoran lain di Jakarta","Meningkatkan digital presence melalui media sosial, meningkatkan rating melalui layanan pelanggan yang lebih baik, menawarkan menu baru yang inovatif",menengah,sedang,8,"""Halo Goodtime Restaurant & Bar, saya tahu Anda kesulitan meningkatkan digital presence dan melayani pelanggan yang semakin banyak. Dengan automation order dan pesanan makanan, Anda bisa meningkatkan kecepatan layanan dan menawarkan menu baru yang inovatif. Saya bisa membantu Anda dengan sistem yang efektif dan mudah digunakan. Ingin kita diskusi lebih lanjut? Klik link ini untuk scheduling pertemuan: [link]"""
Okuzono Japanese Dining,Restoran Izakaya,"4,6","
10, Jl. Suryo No.1 10, RT.10/RW.3, Rw. Bar., Kec. Kby. Baru, Kota Jakarta Selatan, Daerah Khusus Ibukota Jakarta 12180","
0811-180-958",https://okuzonogroup.com/,restoran,Jaksel,pending,"Kompetisi dari restoran lain di Jakarta, ketergantungan pada lokasi fisik, potensi kehilangan pelanggan karena perubahan tren","Meningkatkan pengalaman pelanggan melalui teknologi, memperluas jaringan melalui delivery atau take away, meningkatkan rating melalui layanan pelanggan",menengah,sedang,8,"""Halo Okuzono Japanese Dining! Saya paham kamu sedang berjuang untuk tetap relevan di Jakarta yang semakin sibuk. Dengan teknologi automation, kita bisa meningkatkan pengalaman pelanggan, memperluas jaringan melalui delivery, dan meningkatkan rating melalui layanan pelanggan yang lebih baik. Saya ingin menunjukkan contoh bagaimana automation bisa membantu bisnis seperti Okuzono. Ingin tahu lebih lanjut? Saya bisa jadwalkan pertemuan untuk membahas lebih detail. Apa kamu tertarik?"""
Lumpang Emas Signature - Prapanca,Restoran Indonesia,"4,8","
Jl. Prapanca Raya No.40A, RT.2/RW.3, Pulo, Kec. Kby. Baru, Kota Jakarta Selatan, Daerah Khusus Ibukota Jakarta 12160","
(021) 80600900",https://lumpangemas.com/,restoran,Jaksel,pending,"ketergantungan pada rating online, kekurangan promosi digital, potensi kehilangan pelanggan akibat perubahan tren","meningkatkan promosi digital, memperluas jaringan sosial, meningkatkan kualitas pelayanan",menengah,sedang,8,"""Halo Lumpang Emas Signature - Prapanca! Kami paham bahwa rating online dan promosi digital bisa menjadi tantangan besar untuk Anda. Dengan automation bisnis kami, Anda bisa meningkatkan promosi digital, memperluas jaringan sosial, serta meningkatkan kualitas pelayanan. Ayo kita diskusikan lebih lanjut cara membantu Anda meningkatkan kesuksesan bisnis! Apakah Anda tertarik untuk mencoba? Klik link ini untuk lebih lanjut: [link]"""
Cerita Rasa Nusantara,Restoran Indonesia,"4,6","
Jl. Ampera Raya No.9, RT.4/RW.2, Cilandak Tim., Ps. Minggu, Kota Jakarta Selatan, Daerah Khusus Ibukota Jakarta 12560","
(021) 78831600",http://www.ceritarasa.co.id/,restoran,Jaksel,pending,"ketergantungan pada lokasi fisik, potensi kehilangan pelanggan jika tidak dapat menawarkan pengalaman yang sama di platform online","menawarkan layanan delivery atau take away, meningkatkan kehadiran online melalui media sosial dan website yang lebih interaktif",kecil,lemah,8,"""Halo Cerita Rasa Nusantara, kami tahu kamu masih bergantung pada lokasi fisik dan khawatir kehilangan pelanggan jika tidak memiliki pengalaman online yang sama. Kami bisa membantu kamu meningkatkan kehadiran online dengan automation sistem pesanan online yang mudah digunakan dan dapat diakses oleh pelanggan di mana saja. Dengan demikian, kamu bisa menawarkan delivery dan take away dengan lebih mudah. Ingin kita diskusikan lebih lanjut? Klik link ini untuk jadwal pertemuan: [link]"""
Namaaz Dining,Restoran Indonesia,"4,6","
Jl. Brawijaya VIII No.6A, RT.2/RW.3, Pulo, Kec. Kby. Baru, Kota Jakarta Selatan, Daerah Khusus Ibukota Jakarta 12160","
0811-1557-798",http://www.namaazdining.com/,restoran,Jaksel,pending,"Ketergantungan pada lokasi fisik, kompetisi dari restoran lain di Jakarta Selatan","Meningkatkan digital presence melalui media sosial dan website, menawarkan layanan delivery atau takeaway",menengah,sedang,7,"Hai Namaaz Dining, saya tahu kamu sering merasa terjebak dengan ketergantungan pada lokasi fisik dan kompetisi dari restoran lain di Jakarta Selatan. Saya ingin tawarkan solusi untuk meningkatkan digital presence kamu melalui media sosial dan website, serta menawarkan layanan delivery atau takeaway dengan bantuan automation saya. Dengan demikian, kamu bisa meningkatkan penjualan dan meningkatkan kenyamanan pelanggan. Apakah kamu tertarik untuk mengenal lebih lanjut tentang solusi ini?"
Henshin,Restoran,"4,6","
Jl. H. R. Rasuna Said No.69 Kav. C22A, RT.2/RW.5, Karet Kuningan, Kecamatan Setiabudi, Kota Jakarta Selatan, Daerah Khusus Ibukota Jakarta 12940",N/A,https://www.henshinjakarta.com/,restoran,Jaksel,pending,"Ketergantungan pada lokasi fisik, potensi kehilangan pelanggan karena perubahan tren makanan","Meningkatkan pengalaman pelanggan dengan teknologi, meningkatkan visibilitas melalui media sosial",menengah,sedang,8,"""Halo Henshin, saya tahu kamu masih bergantung pada lokasi fisik dan khawatir kehilangan pelanggan karena tren makanan yang selalu berubah. Dengan automation yang tepat, kita bisa meningkatkan pengalaman pelanggan dan meningkatkan visibilitas di media sosial. Saya bisa membantu kamu dengan mengintegrasikan sistem automasi untuk melayani pelanggan secara lebih efisien. Ingin kita diskusikan lebih lanjut? Saya menunggu responmu!"""
