name,category,rating,address,phone,website,keyword,location,status,pain_points,opportunities,business_size,digital_presence,priority_score,outreach_message
Kopi Nako Depok,Kedai Kopi,"4,7","
Jl. Margonda No.38, Depok, Kec. Pancoran Mas, Kota Depok, Jawa Barat 16431","
0812-8237-9857",N/A,restoran,Depok,pending,"kurangnya website resmi, potensi kehilangan pelanggan karena tidak dapat ditemukan secara online","meningkatkan rating melalui pelayanan yang lebih baik, meningkatkan visibilitas melalui media sosial",kecil,lemah,8,"Hai Kopi Nako Depok, saya tahu kamu sedang mencari cara meningkatkan visibilitas dan mempertahankan pelanggan di era digital. Website dan media sosial yang profesional bisa menjadi jawabannya! Saya bisa membantu kamu dengan automation untuk meningkatkan rating dan meningkatkan jaringan pelanggan. Apakah kamu ingin mencoba?"
Perang Kerang,Restoran Seafood,"4,3","
Jl. Margonda No : 439C, Pondok Cina, Kecamatan Beji, Kota Depok, Jawa Barat 16424","
0877-8280-0572",https://www.instagram.com/perangkerangid,restoran,Depok,pending,"Ketergantungan pada Instagram sebagai platform utama, kurangnya website resmi, dan potensi kehilangan pelanggan karena alamat yang tidak jelas","Mengembangkan website resmi, meningkatkan kehadiran di media sosial lainnya, dan memperluas jaringan pelanggan melalui promosi dan kampanye",kecil,lemah,8,"""Halo Perang Kerang! Kami lihat kamu sudah sukses di Instagram, tapi ingin tahu, apakah kamu ingin meningkatkan bisnismu dengan lebih efektif? Kami bisa membantu kamu membuat website resmi dan otomatisasi proses order online, sehingga pelanggan lebih mudah menemukan dan memesan makananmu. Ingin tahu lebih lanjut? Kirimkan saya pesan ya!"
Kampung Kecil Depok Sawangan,Restoran,"4,7","
Ruko Pancoran Mas, Jl. Raya Sawangan No.81, RT.1/RW.9, Mampang, Kec. Pancoran Mas, Kota Depok, Jawa Barat 16511","
0878-7757-5981",N/A,restoran,Depok,pending,"kurangnya website resmi, potensi kompetisi dari restoran lain di Depok","mengembangkan aplikasi pemesanan online, meningkatkan rating melalui promosi sosial media",kecil,lemah,7,"""Halo Kampung Kecil Depok Sawangan! Saya tahu kamu sedang sibuk menjalankan bisnis restoran yang sukses dengan rating 4,7. Tapi saya juga tahu kamu masih belum punya website resmi dan mungkin merasa kompetisi dengan restoran lain di Depok. Saya ingin bertemu untuk membantu kamu mengembangkan aplikasi pemesanan online yang bisa meningkatkan efisiensi dan rating kamu. Apakah kamu ingin mencoba? Kami bisa membantu!"""
"Sambal Bakar Indonesia, Sawangan",Restoran Indonesia,"4,7","
Jl. Raya Sawangan No.7, Rangkapan Jaya Baru, Kec. Pancoran Mas, Kota Depok, Jawa Barat 16434","
0812-4684-8157",https://www.sambalbakarindonesia.com/,restoran,Depok,pending,"Ketergantungan pada lokasi fisik, kompetisi dari restoran lain di Depok","Meningkatkan digital presence melalui media sosial, meningkatkan rating melalui layanan pelanggan",kecil,sedang,7,"""Halo Sambal Bakar Indonesia, Sawangan. Saya tahu kamu terus berusaha meningkatkan bisnis di Depok, tapi kompetisi dari restoran lain bisa sangat sulit. Saya punya solusi untuk membantu kamu meningkatkan digital presence dan layanan pelanggan melalui automation media sosial dan sistem pelayanan pelanggan. Ingin tahu lebih lanjut? Silakan hubungi saya untuk chat lebih lanjut."""
Rumah Makan Saung Talaga,Restoran Sunda,"4,3","
Jl. Raya Sawangan No.1, Rangkapan Jaya, Kec. Pancoran Mas, Kota Depok, Jawa Barat 16435","
0851-7115-4607",N/A,restoran,Depok,pending,"kurangnya website formal, keterbatasan promosi online","meningkatkan rating dengan meningkatkan kualitas makanan, meningkatkan kehadiran online",kecil,lemah,7,"""Halo Rumah Makan Saung Talaga, saya melihat kamu memiliki potensi besar untuk meningkatkan rating dan kehadiran online! Saya rasa kurangnya website dan promosi online membuat kamu ketinggalan. Saya bisa membantu kamu dengan automation website dan sistem pemesanan online, sehingga kamu bisa fokus pada yang paling penting, yaitu meningkatkan kualitas makanan! Ingin tahu lebih lanjut? Mari kita bicarakan!"""
de'Clan Resto & Cafe Depok,Restoran,"4,7","
Jl. Tole Iskandar No.33, Depok, Kec. Pancoran Mas, Kota Depok, Jawa Barat 16431","
0819-3808-0816",N/A,restoran,Depok,pending,"kurangnya website resmi, potensi kehilangan pelanggan karena alamat yang tidak jelas","peningkatan rating, peningkatan kehadiran digital, peningkatan pemasaran melalui media sosial",kecil,lemah,8,"Halo de'Clan Resto & Cafe Depok! Saya tahu kamu sedang mencari cara untuk meningkatkan rating dan kehadiran digital. Saya rasa kurangnya website resmi dan alamat yang tidak jelas membuat kamu kehilangan beberapa pelanggan potensial. Saya bisa membantu kamu membuat website yang responsif dan mudah diakses melalui automation, serta meningkatkan kehadiran digital melalui media sosial. Saya ingin membahas lebih lanjut tentang ini, apa kira-kira waktu yang tepat untuk kita berbicara?"
